"I don ’ t understand why you always look so happy, so energetic. It seems like you ’ Ve got good news everyday. ", Really? Do I look happy all the time? , All I know is you look quite differently from other teachers. ," Oh, do you know why? Actually, it ’ s easy. Because I always exercise. My exercise, I think, is very hard. I often feel very good after conquering these difficulties. I feel alive! "," Oh, I know. I saw you doing pull-ups one time on the campus 5 and some students trying to imitate you. "," Yeah, they are doing it for fun. Seldom would people like my exercise. It ’ s difficult and boring. ", It ’ s true. Many students do the exercise when they have to. We have P. E. once a week. , But I think Chinese students need to exercise more. Besides exercise will help them learn new things better. Don ’ t students want to have a good memory? , Of course. I didn ’ t know that. I only know exercise makes bodies stronger. I should take some exercise then. Do you have any suggestions? ," Well, do what you like to do. It can be anything. Jogging, doing aerobics, going bicycling, and playing ping-pong. Absolutely anything. Doing three or more workouts a week is good for you. But remember to do some stretches first. "," Oh, I know. Thank you. "
"Good morning, sir. May I help you? ", Good morning. I'd like to pay my bill. , OK. In cash or by credit? , In cash. How much is the total charge? , Five hundred and thirty yuan altogether including charges for service. , Here you are. Thanks for your wonderful service. , Not at all. Welcome again. 
"Excuse me, can you tell me where I can go fishing? ", I like fishing too. I usually fish near the lake. ," I want to go fishing today, but I have left my rod and fishing line at home. ", What a shame. 
"Hello, Mary. Why are you standing here in the cold wind? ", I ’ m waiting for a bus and going for a walk in the park. , Going for a walk in such a cold weather? , I always like to go for a walk before a supper. , I see. 
"Hi, I'd like to return this radio. ", All right. Do you have the receipt? , Here it is. , May I ask why you're returning the radio? , It does not work very well. , Would you like to exchange it? , No. I'd just like a refund. , Certainly. This will take only a few seconds. 
"Can I help you, sir? ", I want to have a haircut. , Please take a seat. Do you need a shampoo? , How much is a regular haircut without shampoo? , $ 10. , And how much for haircut with shampoo? , The total charge is $ 15. ," Since it is, I need a haircut with shampoo. "," Well, what shampoo do you prefer? "," SEEK, please. ", ( 5 minutes later ) What sort of hairstyles do you like? , What hairstyle do you feel will look best on me? , I think a crew cut is the most suitable for you. , I have the same idea as you. 
Do you have any idea for this vacation? , Why don't we spend this vacation earning our tuition? ," Oh, yeah, let's try to find some jobs. ", OK. 
So it looks like we start selling in the U. S. next year. , Did Mr. Lin put you in charge of marketing? ," He's still not sure whether he wants to put me in charge, or whether he wants to hire an American.But even if he hires an American, I'll probably be transferred to our American office. ", Where will it be? , We aren't sure yet. Maybe L. A. I think L. A. would be the best idea. , Is it because of trade negotiations that we can start selling in the U. S.? ," Yes, the recent agreements between the two governments have changed everything.Now we have the right to sell in America at a much lower tariff.It' s going to be good. We can compete more directly with them. ", Great. , Our computers have a high level of quality now.We can demonstrate it. And our prices will be good.So I think it will really be worthwhile. , You seem excited about it. ," Well, you know I studied marketing in America.So maybe the thought of going back there to promote our brand is kind of exciting to me. I'd love to be part of the team. ", Do you honestly think we can compete though? All the computer giants are there. ," Yes, I do. I think we can compete. I think we can make a name for ourselves.It will be hard at first. But if we develop a good advertising campaign, I think we can break into the market. ", The company will have to choose a good advertising firm.And then there's the problem of quality.How do we convince American buyers that our quality is good? ," It takes some time.Because even if the quality is high, people won't accept a high tech product unless they recognize the name.Name recognition is crucial. "," Well, I hope it all works out, John. I think if you're part of the team, things will go well.But you know we'd all miss you here. So I won't say I'm happy to think that you're leaving. "," That's very nice of you to say.But if we set up an office there in the States, maybe you could try to become part of it. "," Me? No way. I'm dedicated to the company, but I'm not going to leave Taiwan. I'm happy here. "
"What's wrong, Frank? ", I didn't make the soccer team. , Cheer up! It's not the end of the world. 
Okay. This trail looks the best. It's a little steep. But I'm sure it will be alright. ," Well. You're the tour guide, I'll follow you. ",... What a stink. This place stinks like rotten eggs. , That's sulphur you can smell. The whole of Taiwan is a volcanic region. That's why Taiwan has so many hot springs. It's volcanic activity.The sulfur smoke that you can smell is coming from those fumaroles over there. , Suddenly the' great outdoors' isn't so appealing. Let's hike a little faster... 
"Would you mind taking your feet off the table, Mike? ", Not at all. But I've found satisfaction in it! , Do you put your feet on your own table? ," No, I never do that. ", Why not? ," I don't want to mark my table, of course. "," Well, will you please put them down? ", I'm sorry. I thought you wouldn't come back so early. , I forgot something on the table. ," Oh, you've got a good memory. "
Good evening. Can I help you? ," Yes, I'd like to check in, please. M y name is Peter Wang. I have a reservation for three nights. "," Just a moment, please. Oh, yes. One twin and one single. Is that right? "," Yes, I'm with my wife and child. "," Will you fill out this form, please? "
"What sort of shopping is nearby, Mr. Taylor? ", Call me John. This is a great area of the city for shopping. There ’ s a grocery store just around the corner. , What about things other than food? ," Well, the Riverside Mall has 200 stores in it, including four major department stores. ", Are there small shops near here as well? ," Yes, on 4th street, near the movie theater there are many specialty shops, including clothing boutiques. "," Well, that sounds just wonderful. "," Yes, it ’ s a really nice neighborhood. "
I've just been a little depressed lately. , What's wrong? , Nothing really. , Then just keep your chin up. 
"Come on, Tara. Let ’ s go up to the window and buy two tickets. The movie is starting in a few minutes. ", We can ’ t break into the line. Don ’ t be so impatient. We ’ ll be at the front of the line soon. ," Two tickets, please. How much are they? "," Oh no, Ari. I didn ’ t mean for you to pay for me when I invited you to go tonight. Let ’ s go Dutch. I ’ ll pay my own way. I insist. ", I ’ m looking forward to this film. I read a good review of it in this morning ’ s newspaper. ," Me, too. It will be great to see something light and funny for a change. I ’ m tired of heavy drama. ", Are these seats okay? ," They ’ re fine, but I can ’ t watch a movie without popcorn. "
"I wonder if you could help me, I'm looking for a room. "," Well, I have got a vacancy. ", What sort of price are you asking? , Eight dollars fifty a week excluding laundry. , Would it be convenient to see the room? , Can you call back later? We're right in the middle of lunch. 
Bob! Your eyes look bloodshot. Did you not sleep well? , I had a drop too much last night. I attended a banquet given by a Chinese colleague of mine. And it was startling for me to find that people are forced to drink against their will on a Chinese table. ," You have it right. Alcohol is a medium for communicating emotion in China. Drinking with business partners or would-be friends is a way of solidifying friendship, especially in Northern China. "," I just felt embarrassed if I refused to drink when people toasted to me. But if I keep gulping down one cup after another, I'm afraid I would feel unfit or sick. "," You lose face by refusing to drink, and the host might think you refuse to give him face. The right thing to do seems to be drinking yourself into incoherence until you throw up. This will endear you to your friends. "," A few guys even threw a drunken fit last night, crying hoarsely and bawling whole heaps of nonsense that I never understood. "," Then he must be opening his heart to the friends. In a word, as long as you demonstrate a readiness to drink more in spite of already suffering extreme discomfort, no one will jeer at you. ", I got you. Next time. I'll preface a toast with a statement like' I can't drink any more' and then drink anyway. 
"Ms. Wang, this is Mr. Cooper, president of Ivy Publishing. "," It's nice to meet you, Mr. Cooper. "," Nice to meet you, Ms. Wang. You must be exhausted after your long trip from Canada. "," Yes, it was quite a long flight. I'm glad to finally be here. "
"I'm sorry to interrupt you. Please take care not to make a mess while you are selecting goods. If you don't want it, please replace it. "," Oh, I'm terribly sorry. but I couldn't find the yoghurt I saw here last time. ", What's the brand? , San Yuan. ," Oh, it's out of stock at the moment. Why don't you choose another brand instead? ", I'm not used to other brands. , You can have a try. Maybe you will like it. , OK. I hope so. 
Don't you ever cheat on me. , Why would I do that? , Because men like to cheat. ," Some men do, but not me. ", I'm watching you. , I'm an open book. Watch me all you want. ," If I catch you, you'll be sorry. "," You won't catch me, because I love you. I'm not a cheater. ", I will poke your eyes out. , I don't want any other woman. ," I will chop your toes off, one by one. "," Honey, please. You're the only woman for me, forever. I swear it. "
How can I help you today? , I am returning something that I bought yesterday. , What would you like to return? , I'm returning a cellphone. , Was there something wrong with it? , It's defective. , What isn't working on it? , It keeps turning off on it's own. ," Alright, do you have the receipt? ", I have it right here. , I'm going to take care of this and refund your money. , Thanks for your help. 
"Hi, Mary. I haven't seen you in ages! I heard that you and Daniel are getting married on August 8th, the opening day of the 2008 Olympic Games. Is it true? "," yes, it is. We've been dating for over 7 years. We have decided to get married on a special day and we think August 8th, 2008 is a red-letter day. ", good for you! It sounds like you've done a lot of planning in a very short time. ," yes, there is a lot of to be taken care of---wedding photos, wedding dress, catering, transport, hotel, etc... ", is everything ready now? ," almost. The only thing that isn't ready is the hotel. As a lot of people have chosen that day to get married, it is hard to find a hotel that isn't too expensive. ", have you tried The Peninsula Palace Beijing? My wedding reception was held there and they did an excellent job. ," yes, we called, but it is booked up. The only choice is the Regent Beijing but we haven't made up our minds yet. "," it's an excellent hotel. A friend of mine had her wedding reception there and said it was perfect, though very expensive. ", that's why we want to have a look at other hotels. We don ’ t want to spend too much on an extravagant wedding reception. , I guess you're right. I can help you ask other hotels. I am sure there are probably some available. , thank you. , my pleasure. 
"What happen, John? ", Nothing. , Why do you look unhappy? , I ’ m rather disappointed at not being able to see my best friend off. ," Oh, cheer up. He ’ ll understand you. "
Do you want to buy something here? , These shoes are great! What is the price of this? , This one is two hundred yuan. , That's too much! 
Could I make a reservation for Flight 10 to Tokyo? ," I'm sorry, but everything is taken. ", How about the next flight-tomorrow at two o'clock? ," Yes, I can give you a reservation on that. "
There is a problem in my apartment. , What is it? ," A pipe broke in my wall, and water is leaking. ", Is the water causing any damage? ," Yes, it ’ s creating mildew on the walls. ", I won ’ t be able to fix the pipe until tomorrow. , I can call a plumber to fix it right now. , I ’ ll do it for you. ," Well, you can ’ t do it until tomorrow, and I need it fixed now. ", That ’ s true. , You ’ re okay with me calling someone? , I ’ m all right with that. 
Guess who I saw yesterday? , Who? , My cousin Monk. Have you seen her lately? , Not for a couple of years. What happened to her? , Nothing exactly. She's grown into a very attractive young lady. ," Oh, she is. "," You know, her long lovely blond hair and beautiful blue eyes really make her stand out from others. ", Not surprising. I bet she's very tall and slim. , Yean. Around five feet five inches tall. 
"Tiffany, why are more and more people turning to the Web to find a mate? "," I think that, as more people use the Internet for both work and pleasure, it makes more sense as a tool to connect with people, and the stigma of meeting someone online is reduced. ", There are actually special sites for people looking to date within their specific ethnic group and age group. But how should you screen potential mates? Do you suggest talking to them on the phone right away or communicating via e-mail? , I would say do not make the e-mail exchange too long. A lot of times a connection via e-mail creates almost a false sense of intimacy. Quickly make sure there is a connection in the physical world. , Can you give us any other safety tips for people pursuing relationships on the Net? ," I'd suggest you not give out too much personal information, like your home address, until after several dates. Just keep up the same guards you would keep up if you were meeting any stranger. "," Besides the growth of these matchmaker sites, do you have any stats on success rates? Are people out there finding true and lasting love through the Internet "," Well, for a site like ecrush.com, since their debut in Valentine's Day in 1999, of the 1.5 million people who have joined ecrush.com, 300000 have actually matched. ", Do you have any successful stories to share? ," Yes, the couple that I highlighted at today's show met on Match.com and they're getting married this summer. "
"Mom, is there anything in the fridge I can eat before dinner? ", There's some leftover pizza from last night. , Anything else? ," Um, I think there may be some leftover lasagna from the other day. ", Do I have any other choices? , There might be some birthday cake left in the freezer. , Is everything in the fridge leftovers? I hate leftovers! , You can wash the vegetables and cut the chicken and I'll make dinner! 
Wow! Look at all these books! I bet I can find a book about anything here! , Shih!! Please keep your voice down. There are people reading and studying here. ," Ok, I'm sorry. Are you the librarian? Maybe you can help me, I am looking for a book. "," Yes I am. You can check our online catalog to search the book you want based on the genre, title or if you know the author, I can point you towards the right direction. ", I am looking for a book that has nursery rhymes. , That would be in our children's section. That book shelf there on the right. ," Ok, I would like to check out these books. ", Do you have a library card? , No. How do I get one? , I just need to see your drivers license or utility bill to prove that you a resident of this state. , Here you go. ," So you are all set. You can have these books for two weeks. If you need to have them longer, you can bring them here to renew them. If you don't, you get charged ten cents a day for each book. "," Ok, thanks! "
How many people are there in your family? ," My immediate family is quite small. It's just my older step-brother, my mom, my step-dad and me. How about you? "," I have a large family. I have three older sisters, my twin sister, a younger brother, and my parents. ", I didn't know you were a twin! Are you identical or fraternal? ," We're identical. I mean, we look exactly the same, but we complete opposites when it comes to everything else! "," Interesting. It must be great having a twin sister. Are you best friends, too? "," We used to be really close, but that all changed once she moved to Shanghai. How about your family? You didn't mention to your biological father. "," I don't know much about him. He died when I was just a baby. Even though I don't have a blood relationship with my step-father and step-brother, I consider them to be my real family. ", What about your step-brother's mother? Does he keep in touch with her? ," No, she also died when my step-brother was little. My mother and my step-father met each other shortly after my father died and became good friends. They ended up getting married a few years later. ", Sounds like it was ment to be. 
"Saying you want to kill yourself, you terrified me out of my wits. ", I was playing a joke on you. , That ’ s too much. ," Dear, forgive me. I won ’ t do that again. "
"Hey, what's up? "," Oh, nothing. ", What were you writing? , ( Laugh ) All right. You caught me in the act. I finally worked up the nerve to ask Diana out. I was just writing a note to put on her desk. , You mean you're going to ask her out in a note? You big chicken! , I admit it. I'm a wuss. I just can't do it in person. ," But, you work with her everyday. "," That's different. When I'm working, I'm in a different frame of mind. But, when I even think about asking her out, I get tongue-tied. At least in a note, I can get the words out without turning beet red. ", You've dated a lot. What's so different about Diana? ," Well, for one thing, she's gorgeous. She's so upbeat and sweet. Who doesn't like her? Oh, I don't know. All I do know is that I think we have great chemistry together. But, what if I'm wrong. Maybe she's just been nice to me out of courtesy and doesn't think of me that way. Oh... forget it. This was a bad idea. "," Well, I guess you don't want this note, then. ", What note? , I was looking for you to deliver this note from Diana. She wants to know if you want to go to the office party with her tomorrow night. , You're kidding! I can't believe you've been standing this entire time and didn't say anything. ," Sorry. What can I say? Now, do you want the note or what? "," Yeah, I want the note. ", Have a great time tomorrow night. , Thanks. I plan on it. 
"Harry, do you like the opera? "," No, not really. ", Why is that? It is called real art. ," Well, it's very expensive and they're usually singing in another language. That kind of gets on my nerves. "," Yeah, that makes sense. "
I've never met anyone like Clyde before. , He's such a buppie-a black yuppie. Black people come in all shapes and sizes. Just check out the party. , Wow! There are so many different people here. I expected mostly athletes and rappers. ," You'll find some of those here, too. But not if you don't shake it up! There's an African saying, “ If you can talk, you can sing! If you can walk, you can dance! ” ", Then I'll just shut up and sit down! 
I hear you and James are engaged at last. ," Yes, we are. ", When are you getting married? , In the spring. ," Oh, lovely.Where' s the wedding going to be? "," Well.. we're not sure yet, probably in St.Albans. "," Oh, yes, your parents live there, don't they? "," Yes, that's right. ", Where are you going to live after you're married? , We're going to buy a flat or a small house somewhere in South London. , Are you going to give up your job? ," Yes, probably but I may look for another one when we're settled in. "
How beautiful the flower is! ," Really, it's so beautiful. "," You like it. Well, I'll gather in for you. ", You mustn't pick it in this place. , Where it is? , It's a private garden. 
Who's that over here? , That's the new teacher. , What do you think of the teacher? , She's very nice. , What does she teach? ," English, of course. ", Is she your teacher? , Yes. She teaches our class three times a week. , Can she speak Chinese to her students? , Not very much. , It's a good thing you can speak English! 
Have you heard that Tom and his wife divorced? , I didn't hear that. But I can deduce the reason. , Really? Say it! ," Tom is a kind guy, but addicted to gambling. He spends all his time gambling in the casino. And his wife can't put up with his incessant gambling any longer, so she divorced him. Is that right? "," Yeah, quite right. Gambling broke up a happy family. "," Yeah! Gambling is often a curse. By gambling we lose time and treasure, two things most precious to a man. "," Besides that, many people took to gambling and got in over their heads, and gradually ruined themselves. "," In a word, gambling is a vice. We should be away from it. "
Welcome to our shop. It seems you are interested in this dress. , Yes. But I am afraid it is too thick to wear in summer. ," That's no problem. It is made of linen, so you won't feel hot in it. I can assure you it is of superior quality. What is more, it is very popular with young women. ", How much is it? , 88 Yuan. ," OK, that is reasonable. I will take it. "
I really need to start eating healthier. , I have to start eating better too. , What kind of food do you usually eat? ," I try my best to eat only fruits, vegetables, and chicken. ", Is that really all that you eat? , That's basically it. , How do you stick to only those foods? ," Actually, fruits and veggies are really good for you. "," Yeah, I know, but what about the chicken? "," I mainly eat baked chicken, because there's not a lot of fat. ", That does sound pretty good. ," I know it does, and that's because it is. "
I ’ d like to send this parcel to Australia. ," Certainly. Could you put it on the scales, so I can check the weight? ", Sure. It ’ s not very heavy. , That ’ s 850 grams. The coasts depends on how you would like to send it. , I see. What are the options? I suppose airmail is faster and more expensive than surface mail. , That ’ s right. Sending it by airmail will cost twelve dollars and sending it by surface mail will cost eight dollars. , How long will it take to get there? , Airmail should take four or five days and surface mail should take about two weeks. ," It that case, I ’ ll send it by airmail. I ’ d like to send it as a registered parcel. ", No problem. That ’ s one dollar extra. , Thanks very much. There ’ s thirteen dollars. , There ’ s you receipt. Goodbye. 
"What ’ s the matter, dear? "," Something awful happened. We went to the Portobello Road, and someone stole my handbag. "," Oh, dear. Did you lose a lot of money? ", No. Only a few pounds. But my passport was in the bag. That ’ what I ’ m really worry about. , You must tell the embassy about it. And I think they ’ ll issue you with a new one. , I ’ d better go tomorrow. , No. But you mustn ’ t leave it too long. Did you report it the police? 
I am sorry. I didn ’ t accomplish the job on time. , That ’ s all right. Everyone feels under the weather sometimes. Just finish the rest when you feel well. 
"Yes, sir. May I help you? ", Please I'd like a ticket to New York. , For today? ," No, early saturday morning. ", We have a flight that we'll put you there at ten AM. Is that ok? , Nothing earlier? I prefer flight at 9 thirty. ," I'm afraid not, unless you want a night flight. "," No, exactly not. ", How about afternoon? , Sounds not good. I won't take it. 
It smells like an ashtray in here! , Hi honey! What ’ s wrong? Why do you have that look on your face? , What ’ s wrong? I thought we agreed that you were gonna quit smoking. , No! I said I was going to cut down which is very different. You can ’ t just expect me to go cold turkey overnight! ," Look, there are other ways to quit. You can try the nicotine patch, or nicotine chewing gum. We spend a fortune on cigarettes every month and now laws are cracking down and not allowing smoking in any public place. It ’ s not like you can just light up like before. "," I know, I know. I am trying but, I don ’ t have the willpower to just quit. I can ’ t fight with the urge to reach for my pack of smokes in the morning with coffee or after lunch! Please understand? ", Fine! I want a divorce! 
I'm so glad that the spring festival is near at hand. , me. too i like the festival best of all. ," Think of the big face down the eve, hmm. "," And special TV programs, fire crackers and the games to play. "," Hey, do you know any mystery belief serve the festival? ", Such as... , You know why fire crackers are set off in festival. , Why? to welcome the new year of course. , And also to frighten away evil spirits. , Really? , And my parents say the whole year will be as good or as bad as new year day itself and bad or rude words on the day will bring a bad year. ," Oh, that's why my parents never scold me that day. they always try to avoid tears and quarrels. "
"Cindy, I have this room to myself? ", It's all yours. , It's twice as big as my room in Taiwan! ," Well, I hope it's comfortable enough for you. ", I think I'm going to like it here. , You have a phone on the bedside table that you can use. ," Wow, I have my own bathroom! ", Kind of. It leads to my bedroom. ," We share the same bathroom, in other words. "
