"Jenny, you look terrible. What's eating you? ", Don't brother me! ," Hey, Chillon, I'm just trying to help. "," Sorry, Sally, it's not your fault. "," So, what's the problem? ", I drew a blank on ~ about the test. , No kidding! Didn't you study for it? ," Yeah, but nothing was clear during the test. "," That's too bad, anyway, I'm sure things will turn around next master. ", I'm thinking of dropping out. ," You can't do that, Jenny! "," I'm dead serious about this, Sally. "," Come on, let's talk about it. "
You may not remember me.My name is Joe Brown. ," Yes, of course. I'm Jimmy White. ", Nice to see you again. , Same here. 
"Good morning, Loans. "," Good morning, Mr. Smith. ", I would like to compliment you on your diligence. ," Well, thank you, Mr. Smith. But I was just doing my job. "," Yes. And we're proud of you, Loans. ", It's nice of you to say so. 
I'll come see you tomorrow. , Promise? 
Does your girl friend like swimming? ," Yes, she does. She is good at backstroke and free style. ", Then you can help her with the breaststroke and sidestroke. , But she wants to learn the butterfly stroke , Really? Then just ask her to follow me. ," I heard you are now practicing underwater swimming, aren't you? ", Yes. But I still have some difficulties it breathing. ," Say, kid, keep on practicing, you're sure to be a first-class swimmer. "," To tell you the truth, I have never thought of being a swimmer. I swim just for fun. ", That's good. 
"Jared, I just heard about your father. How is he doing? ", He's in the hospital resting. The doctor's didn't give a clear answer yet. , I'm so sorry to hear that. But this is a good hospital. I'm sure they will do whatever they can. , I hope so. , You must feel really worried right now. But you know your dad is a fighter. , Yeah. I think my mom is the most worried. I'm basically worried about how she is doing. , Where is she right now? , She's in the hospital with my dad. I have to go back tonight. ," Hey, I'll go with you. ", You don't have to. , It's really no problem. , Ok. Let's go right after dinner. 
I have redecorated my bedroom. I decide to repaint the walls and change the pictures. I also bought a new pair of curtains. What do you think of it? , I think is looks great. I really like the light colors you have chosen. The pictures are nice too. Did you bought any new furniture? , I bought a new mattress and some fresh bedclothes. I also bought a new dressing table and a new bedside table. , new furniture makes a room seem so fresh. I see that you also bought a new lamp for your bedside table. , do you think that I should get a new wardrobe? , that wardrobe looks quite big. Is it full of clothes? , yes. I have so many clothes stuffed into it. Perhaps I should get rid of some of them. There are clothes in there that I never wear anymore. , I like to get rid of clothes that I don ’ t wear rather than keeping them in a wardrobe. They take up too much space. There are several charity shops that you can give old clothes to. They will be ," that ’ s a good idea. After I get rid of the old clothes I no longer wear, I can see what new clothes I need to buy. ", I need to buy some new clothes for the summer too. Perhaps we can go together one day. , ok. I ’ ll let you know when I ’ Ve sorted out my clothes. 
"Congratulations, Vivian. You won the grand prize, again. ", Isn't it just great! I just knew I'd win! , You did? How? Did you wear red underwear again this year? , Not only that! , Tell me! Tell me! What's your secret?! ," OK, OK. I'll whisper it to you, but you have to promise not to tell anyone! ", What?! You did that??!!! 
"Hi, Sam. I want to buy a pet. Do you have any ideas? ", You really should go to Rachel's pet store. , Why? anything special there? , It's more than special. You can find as many kinds of animals as you can put a name to and more. ," Oh, really? are there any snakes? ", Snakes? there are even rodents and monkeys! it's a world of exotic pets. , That's terrific. I can't wait to check it out. , Hang on. are you sure you want to keep a non-traditional pet? , Why not? it's so cool. , But it will pose a risk to your health. , Pardon? ," I mean, most reptiles carry some harmful bacteria, they are likely to cause immune system problems. "," Well, I didn't realize that. "," I don't believe it's a good choice to keep those pets, especially for families with young children. "," Oh, I should have thought of my brother's baby girl. Maybe I'll just have a dog instead of an exotic pet. "," Yes, good luck, Maria. "
What did you say? , I said it ’ s a lovely day. Why don't we go for a walk? ," Well, I feel a little tired. ", Come on! Rest breads rust. , Then can you wait a few minutes? I want to finish writing this letter. , I hope it won't be too long. It would be a shame not to take advantage of such lovely weather. , It won't be long. No more than ten minutes. Why don't you go ahead and I'll meet you in the park? , OK! See you later! 
I'm so busy. I don't know how will get this done. , You're not the only one with a lot to do. We are all in the same boat. 
There are lots of new teachers in our class this semester. ," Yeah, so what do you think about the teachers? "," To be honest, I like all of them, except for the math teacher. Though he must be quite young, he seems like an old person. He's so boring. "," I think so too. I don't like him either. Well, who do you like best? ", It might be the English teacher. What about you? ," Me, too. She speaks very clearly and doesn't use very complicated words so that it is easy for us to understand her. ", She is a pretty good teacher! With her help I think I can make great progress in English. ," Yeah, I like her way of teaching. She told us not to cram for exams, and to pay more attention to communicating than memorizing. ", I think it's a good way to develop our language ability. ," Actually, our new math teacher is a good person. He just can't find an appropriate way to teach us. "
Good afternoon. Can I help you? ," Yes, I would like to check in. ", Do you have a reservation? ," Yes, my name is Steven Smith. I have a reservation from October 2nd to October 6th. I called last week. "," Wait a moment, please. Oh, yes, Steven Smith. It's for a single room with a bath. Is that right? "," Yes, that's right. "," Now, Mr. Smith, could you fill out this registration form, please? "," OK. By the way, where is the restaurant? "," The restaurant is on the second floor. Here is the key to your room. It's on the 6th floor, room 609. The elevator is over there. And we also have a cafeteria on the top floor, if you would like something to drink, you can also call room service. ", Thank you. 
What? , What happened with that guy at the cafe? , nothing , But you ’ re crazy about him? ," Yes, I am. ", Why don ’ t you run off with him? What are you waiting for? , I don ’ t actually know him. , Really? , I only know him through the... you are not gonna believe this. ," Oh, let me guess. Through the internet? ", Yes. , Hmm. You ’ Ve got mail. 
Which language do you speak? ," Well, I studied French at school, but I ’ Ve forgotten most of it. I learnt some Russian while I was studying there and now I study Spanish in evening classes. Do you speak Japanese at home with your parents? "," Yes, I do. I ’ m learning Chinese now on the internet. ", How do you find studying a language on the internet? ," It ’ s not easy, particularly with listening and speaking, because sometimes the connection isn ’ t too good. ", I bet you find the character difficult to write! ," Actually, many of the characters are the same or very similar in both Chinese and Japanese, so they ’ re easy for me. "," So, you can read and write much better than you speak and understand other speakers, right? ", Yes. How are the Spanish classes going? ," In a way, it ’ s similar to your experience of learning Chinese. Some Spanish words are very similar to English ones. But I need to practise listening to native speakers and saying the words myself. "
I can't find my keys. , Where did you See then last? 
Do you believe in god? , Not at all. I ’ m an agnostic. Do you? , I ’ m not sure. Why don ’ t you believe there is a god? , I think everything has a scientific explanation rather than a theological one. ," I basically believe in science over theology. I mean, I believe in evolution for example. However, there are many things that science hasn ’ t explained yet. ", I ’ m sure that science will explain everything eventually. I think that the strangest thing about religion is that so many religions people act in ways that their religion claims are wrong. , For example? ," Religions preach tolerance, but many wars are caused by intolerant religious fanatics. ", Yes. Such people don ’ t appear to be acting in accordance with their religious beliefs. 
He ’ s got laid off again. I do feel sorry for him. , Do you really? , What do you mean? ," Well, I just think he deserves it. "
"I think it is easier to buy a car than to maintain it. What ’ s worse, I just don ’ t trust those vehicle maintenance shops. Sometimes, they overcharge or don ’ t build those parts I have been paying for. Last week, they even tried to persuade me to buy new parts which really need not to be changed. You know, my car is just half a year old and also good brand. I was just wondering about all these. "," There are such shops living on selling parts. I don ’ t like their service either. All they want is your money. But in the long run, they will be losing costumers. Anyway, car service business is new in China. We all have to control what they are doing. Otherwise, they will not improve. ", Is it possible to make a compliant call to some organization what it ’ s someone gets rip-off. ," Yes, there is. Those organizations exist. You always can call a lawyer if you need legal help. "
Yesterday was April the first. , Was it quite special? ," Not for the others, but for me. I was in the library going over my lessons when suddenly one of my roommates came in. He told me that I was wanted on the phone in my dormitory, and that person would call me again several minutes later. ", Did you hurry back to the bedroom? ," Yes. I went back to the dorm only to find my roommates laughing and shouting "" April Fool, April Fool "". "," Oh, your classmates took you in. ", Only then did I realize it was April Fools' Day. 
"hi, come on in. Can I take your coat? "," sure, thanks. I brought you a bottle of wine as well. ", you're the first guest to arrive. I'll just put your coat away and then I'll get you something to drink. , should I take my shoes off? , whatever you prefer. , this is a very nice place. How long have you been living here now? , just over three weeks. Would you like a drink? ," sure, what do you have? "," I've got white wine, red wine, gin and tonics, ginger ale, lemonade, orange juice, and sprite. ", I'll have a glass of red wine please. , one glass of red wine coming up! , so how many people are coming for the dinner tonight? , there's just going to be 6 of us tonight. ," oh, I thought there were going to be eight. who isn't coming? ", Marcia and Paul called to cancel at the last moment. Paul was running late and Marcia wasn't feeling well. , that's too bad.They' re such good company. , I think there's someone at the door. , excuse me while I go and get that. 
I hear you bought a new house in the northern suburbs. ," That ’ s right, we bought it the same day we came on the market. ", What kind of house is it? , It ’ s a wonderful Spanish style. ," Oh, I love the roof tiles on Spanish style houses. ", And it ’ s a bargaining. A house like this in river side costs double the price. ," Great, is it a two bedroom house? "," No, it has three bedrooms and three beds, and has a living room with a twelve-foot ceiling. There ’ s a two-car garage. ", That ’ s a nice area too. It ’ ll be a good investment for you. ," Yeas, when will you buy a house? "," Not untill the end of this year, you know, just before my wedding. "," Right, congratulations. ", Thank you. 
Excuse me! Does this bus go to the railway station? ," No, You're got on the wrong bus. You can take a No. 22 bus at the University station and then transfer to a No. 83 bus at the railway station. ", OK! Thank you very much! 
I was just about to go to bed when the telephone rang last night. , Who was it? , Kate. She said she was too excited to go to sleep. , She never cares about others. , It ’ s true. Guess what we were talking about last night. ," Her new boyfriend, right? "," Yeah, how do you know about that? ", I was also interrupted by her last week because of such a thing. 
"Hey, there's Leo. I wonder why he's walking arm in arm with that young woman. ", It's as plain as the nose on your face. They're dating each other. , You're pulling my leg! She must be thirty years younger than Leo. Talk about robbing the cradle! ," Well, you can bet this relationship's going to be a flash in the pan. ", It must have been love at first sight because I know he didn't have a girlfriend last week. ," I think you are absolutely right. Actually, my father proposed to my mother after knowing her only two weeks. They got married a month later. "
I'm checking out in about half an hour. ," Whenever you're ready to check out, I'll be ready, sir. "," Great! As you know however, the day in New York has hardly begun. ", You're right. It's only 9 ," Therefore, I think I'll explore New York some more. But I need to store my bags. "," Sir, our storage facility is merely $ 5 an hour. You also need to leave a deposit. ", My luggage isn't enough of a deposit? ," Unfortunately, it isn't. VISA or MasterCard will suffice, though. "," Well, then. Let me put on my thinking cap for a moment. "," Better hurry, sir. Remember you have to check out in less than half an hour. "
I'm going to the pub tonight. , Don't get drunk. 
Hey! Are you getting dressed? ," Yes, I am. ", Why? What time is it? , It's a quarter to eight. I'm going to work. , But it's Saturday!! , I'm working on Saturday mornings this month.Are you getting up? ," No, I'm not. I'm staying in bed. ", OK. See you at noon. , If I'm awake. 
What date is it today? , Why? , Look at the girls in the street. They all have a bunch of flowers.Is it Valentine's Day? ," Oh, yes! I completely forgot about it. ", Did you have a fight with Jack? ," No, but now he'll be in trouble. What's a boyfriend for? To forget about Valentine's Day? "," Come on, dear! You forgot it, too. "," You know, it's OK for a girl to forget these "" big days "", but for a guy, to do that is unforgivable. ", Is that your phone? ," Oh, it's Jack. Excuse me. ", Wow! Good timing. , He asked me out to a dinner tonight. How about joining us? , Come on! Three's a crowd! , So what? , Just go! It's Valentine's Day! 
Your ring is very beautiful. , Thank you. It has been handed down in my family for three generations. ," Oh, it is precious. ", It surely is. 
"Julia, what's the weather forecast for tomorrow? ", It says a storm may come tomorrow. , Oh! I hate rainy days! ," Me, too. I'm always in low spirits when it rains. Are you going out tomorrow? ", Yes. I have to drive to Washington D. C. , What bad luck! , Yeah! But you know sometimes the weather forecast is not correct. Maybe tomorrow is a clear day. Who knows? ," Yeah, maybe you are right! "
Hello Gina! We've spoken so many times on the phone but's it's so good to finally meet you in person! ," Hello sir. Good to meet you, too. "," Oh, please don't call me sir. Just call me Jason. "," Ok, Jason. So how was the flight? ", Pretty good. There was a bit of turbulence while we were over the Pacific Ocean but it wasn't too bad. The worst thing was the guy behind me. He snored all through the night! , Really? But you were in first class! Nobody woke that guy up? , The stewardess said it's not company policy to wake people up for any reason. , That's terrible! So you didn't get any sleep? , Not much... but that's ok... I'm a night owl anyway. ," So, aside from visiting our factory and offices, are there any other things you want to accomplish while you're in China? ", I'd love to squeeze in a trip to the Great Wall. , That's not a problem. We can have a company car take you there. It's only about a two hour drive. 
"I am sorry for damaging your car, sir. ", Don't worry about it. Just leave it to the insurance companies. ," The car park in this community is over crowded, isn't it? "," Yeah, more and more cars. People should try to take public transportation. "," There aren't enough buses in this city, are there? "," Yeah, sometimes I really feel like writing a letter to the mayor. ", That's too much of hassle. We just want a little bigger parking space. ," Have you taken this to the property management, yet? "," No. but I'm gonna. You know, several months ago, I backed into red Honda when parking. ", Where? On the road? ," No, right here in the parking lot. It was parked right here in your space. The left rearview mirror was smashed. ", Is the car owner a lady with deafening voice? , Yes! How do you know that? , That's my wife! 
"Hi, I'm John Sandals, and I have a reservation. "," Would you show me your ID, sir, please? ", Here you go. ," Thank you very much. Now, sir, do you have a credit card? ", Certainly! Would you like my American Express card? ," Regrettably, Mr. Sandals, we accept only MasterCard or VISA. ", I thought American Express was accepted everywhere. Never mind. Here's my VISA. ," Thanks. You're in room 507, a big, nonsmoking room, with a queen bed. Is that okay, sir? "," Yes, that's just fine. ", I'm happy to hear that. Here is your key. Just dial 0 if you need anything. 
"I'd like to buy a bottle of Centrum, a dozen tooth brushes, some baby's wipes, and a small bottle of aspirin ;",Please visit t.cn., Give me one bottle of one hundred tablets. , And what kind of toothbrushes would you like? , Can I have a look at them? ," Sure. This brand is supposed to be very good, but they're expensive. Those are new products. They come in several colors and sizes. There is also hard, soft, and medium. ", Are they cheaper? ," This one is 10 % off. That one has no reduction, but you can get a free tube of toothpaste with six toothbrushes. "," So if I buy a dozen, I'll get two free tubes of toothpaste? ", That's right. 
I have to find a living room set. , Where are you planning on looking for one? , I don't know. , I can tell you where I got mine. , Where did you go to find yours? , IKEA has beautiful furniture. , Does the furniture from IKEA cost a lot? , The furniture cost a couple thousand dollars. , How good of quality is the furniture? , It's very sturdy. You get what you pay for. , I don't mind paying for quality workmanship. , I assure you that you're paying for quality. 
Maintenance Department. May I come in? ," Come in, please. ", Did you call us? , Yes. The television is not working properly. , What's the problem? ," The remote control doesn't work. I turned on the television, but I can't change the channel. "," Let me have a look. I think the batteries should be changed. Let me replace them with new ones. Now, it's working. ", That's great. , Is there anything else I can do for you? ," No, thanks. "," If you have any problems, just call us. ", OK. Thank you. 
"OK class, so today we are going to continue with our anatomy class, today we will review everything we have learned. Can anyone tell me what the first major organ is? ", The brain! ," That's right, the brain! It serves as a control center for the body, handling the processes of the central nervous system as well as cognition. Then what major organ is in our chest? ", The heart! ," Very good! It pumps blood throughout the body, using the circulatory system such as blood vessels and veins. Now let's not forget that our lungs provide oxygen to our heart and body to keep us alive! Now what about the organs that help us digest food? ", The stomach and intestines! , Very good! Let's not forget that the stomach is the one that breaks down our food and our intestines process that food and then expel the waste. Are we forgetting anything? ," Yeah! Our kidneys, liver and bladder! "," Oh yes, you are right. Very important organs indeed. "," So what do these organs do, teacher? "," Well, mumm, they... Time for a break! We can talk about it when you get back. "
"Excuse me, I ordered the well-done steak, but this one is so tough. "," Well, sir, I think I have made a mistake. I will take it back to the kitchen right now. ", I think you should be more careful next time. ," Yes, sir. I'm really so sorry about that. "
"Lily, do you know Lizzy? ", Lizzy who? , Lizzy smith. , Of course I do. ," Then, Do you know her younger sister? ", You mean Mary? , Yes. , Sure. I know her elder sister Sue and younger sister Mary. ," Oh, not bad. Then do you know her mother? "," Yes, certainly. I know her mother and father, and brother and sisters, too. ", That sounds terrific. , Why do you ask me these questions? , I just want to visit the family some day. 
Could you show me where the ice cream is located? , Just go to the end of the store. And it will be on your right. We have all the ice creams and frozen foods back there in the freezers. , This is my first time here. , Please notice all of our aisles are numbered and classified by signs on the ceiling. That might help you. , I'm glad I asked you. So this is aisle 6 where I can find all the canned fruits and vegetables. , That ’ s correct. 
Welcome to Perfect Getaway Tours. How can I help you? , I would like to plan a surprise getaway for me and my wife. ," Very well, we have a couple of different options such as beaches, the wilderness, the countryside or even going to a spa for the weekend. ", I think something in the countryside would be nice. , Perfect! This package includes round-trip flights to New Hampshire. A free airport pick - up is included. Our VIP limousine will pick you up and provide you with complimentary champagne and finger , Sounds good! What is the hotel that we will be staying at like? , That is the best part.Your hotel is actually an old country villa that has been restored and refurbished to accommodate a maximum of that is guests.You will enjoy an intimate and private time in this , Wow! This sounds like something my wife would really enjoy! Are there any outdoor activities we can take part in? , Of course! The hotel has a stable with beautiful stallions for a very romantic horseback ride along the country trail. You can also go fishing to the nearby lake or visit the local vineyard. , I ’ m sold! I want to book this trip. I don ’ t care what it costs! Money is no object! 
I broke my sister's mirror. I'm sure it'll get her back up. I really don't know how I can escape the punishment. , You'd better tell your sister what happened and face the music. 
"Excuse me, sir, the toilet in my room doesn't flush. "," I am sorry, sir. Can you tell me your room number? ", 812. , Is there anything else I can do for you? , The tap is always driving. I can't sleep well. ," OK, we will send a repairman to your room right now. "
"Alison, would you like to have some more? ", No thanks. I have had enough. , Actually you haven't have much. ," To tell you the truth, I am on the diet. ", That sounds ridiculous. Why? ," Well, I am gaining weight these days, and I have to watch my calories. "
"Peter, how often do you exercise? "," Well, I swim and run every day. "," Now, tell me, what do you eat? "," Well, I don't eat any meat, but I do eat fish and eggs. ", Do you eat a lot of vegetables? ," Oh yes, and fruit, I love fruit. ", What do you drink? ," Well, I never drink alcohol, coffee or tea. They are very bad for you. ", What do you drink? 
How is your new car? , Perfect. Couldn't be better. , Why do you say so? Can I see your new car? , Of course you can. ( Lead Carl to his garage. ) ," Wow, this new car is dynamite! It is a shiny, beautiful car. ", My car is simply a daisy. It drives smoothly. , The car has very sleek lines. I love it. , I am glad to hear that. I'm really pleased with it. , You made a good choice. 
"Ann, stop bugging Jess and help me order something new. Lattes are so passe these days. ", Why don't you try an Americano? Espresso with water. , Sounds a little weak. , Go with a hammerhead then-espresso mixed with drip coffee. ," Sounds better, but I hope it doesn't inspire me to take a hammer to the client's head. "," Don't worry, James. We'll get this case worked out in no time. "
Would you like to order anything else? ," No, I'm good. All we need now is our check. "," Our waitress has been kind of scarce tonight, hasn't she? "," I think that is our waitress is over by the bar. Boy, the service has not been good this evening. "," She doesn't appear to be headed this way, so I will go get the check. ", Good. Just bring it back and we'll total it together. , Our total for dinner is $ 36.00. , What do you think would be the right amount to tip? , I kind of don't want to leave any tip for the lousy service we received. ," I agree that it was bad service, but I heard one of the other waiters mentioning that it was our server's first night on the job. ", I believe that 10 % is just about right amount. , I think that a tip of $ 3.60 will be the right amount to leave. 
What's wrong with you? , My head hurts badly. , How long has it been like this? , Since last night. , Do you have a sleeping problem? ," Yes, I even can't fall asleep these days. "," I think you'd better have a further exam, and before the result comes out, try to relax yourself and take the medicine before you sleep. It will help you to kill the pain and make you sleep well. "," Is it serious, Doctor? "," When the result comes out, I will tell you about it. Remember, never be afraid or be too tired. "," OK, thank you, Doctor. "
