Have a nice weekend! , Thanks.You too! , Do you have any plans? ," Well, my family's away and I can't afford to do much.What about you? "," Oh, I haven't decided what I'm going to do yet. "
"Where are you from, Laura? "," Well, my whole family is in the United States now, but we're from Costa Rica originally. "," Oh, so you're from South America. "," Actually, Costa Rica isn't in South America. It's in Central America. "," Oh, right. My geography isn't very good! "
what are you doing ;,Please visit t.cn.," you really like brains that make you think, don't you? ", I guess you could say that. What kind of games do you like? , I guess the games I like the most are the ones that I'm good at! , Doesn't everyone? Which games are those? ," Well, I like to play darts. Whenever I go to a bar, I usually play for a few hours. ", Did you play a lot of games when you were little? , My parents used to love to play checkers and dominoes. We used to have family tournaments every weekend. , Do you still like playing those games? 
Good evening! This is Mr. Smith in room 609. ," Good evening, Mr. Smith, What can I do for you? ", I'm going to Shanghai early tomorrow morning. So I would like to request an early morning call. ," Yes, Mr. Smith, when would you like us to call you tomorrow morning? ", I have to be at the conference room of the Garden Hotel in Shanghai by 10 o'clock. I think it will take me three hours to get there. It means that I'll have to be on the road before 7 o'clock at the latest. , That's right. ," Well, in that case, I would like you to wake me up at 5:45. "," OK. Good night, Mr. Smith, Have a good sleep. ", Good night. 
"Steve, when are you going back to America? ", Next week. ," Wow, so soon! I'm going to miss you. "
Can you speak French? ," Yes, I can, but not very well. ", Can you understand your Spanish teacher? ," More or less. How well do you understand Mr. Wang, your Chinese teacher? "," About 40 percent, if he speaks slowly.When he speaks fast, I can only catch a word here and there. But Mr. Wang is an excellent Chinese teacher.With his help, my Chinese is getting better and better e "
"Hi, Mr. Wang. Do you feel like going boating with me? "," Sounds interesting, I haven't gone boating for some time now, and what time? ", How about tomorrow afternoon? , Sure. Where shall I meet you? , At the gate of the park. , Great. I look forward to meeting you. , See you then. , See you. 
Hey Jack. How's it going? , I'm falling in love. , What! With who? , That girl in my econ class. She is so hot. , Did you guys go on a date already? , No. I didn't even talk to her yet. But I think I'm in love. , Does she have a boyfriend? , I don't think so. I've been following her around campus and I haven't seen another guy. ," Dude, you're a stalker man. Just ask her on a date. ", I plan on running into her in the cafeteria when she's alone. I think I'll ask her then. , So why do you think you're in love? , She's the only thing I can think of all day long. ," That's called blind love. Well, I gotta run. Tell me how it goes next week. ", Aright. I'll talk to you later. 
"You are very late, but I was on pins and needles the whole time. "," Oh, I ’ m sorry. "
Plastic bags are widely used nowadays. , But they're hard to be disposed of. ," In this aspect, I think, Pater bags have the edge on plastic bags. "
How may I help you? , I need to return these books. , What happened to this one? , The cover came off. , You ’ re going to need to pay for the damage. , How much are you talking? , It ’ s going to be $ 5. , That ’ s not bad at all. , It really isn ’ t. , Here you go. , Thank you very much. , You ’ re welcome. Have a nice day. 
He is penny wise and pound-foolish. , Why do you say so? ," The trash of the world he sets high price upon, but the heavenly things he shamefully undervalues. ", Maybe all of us are the same. 
What a great weekend that was! , My feelings exactly. , I really enjoy the beach in the summer. , I couldn't agree with you more. , We should come here more often. , You are absolutely right. , I'd like to come back next weekend. , That's exactly the way I feel. 
"Sorry, honey, something has cropped up again. I have to deal with it. Perhaps I will go to back home till very late. ", It's nothing. It's not the first time anyway. ," Oh, come on. I will be back as early as possible. ", I hope so. 
What are you hiding in your coat pocket? , It's a camera. , You want to take pictures of the inside of your pocket? ," Not even funny, Billy. This is my new snapshot sticker camera. ", What's that supposed to mean? ," Well, there are adhesive strips on the backs. You can stick them anywhere. "
Excuse me. Are you Mr. Smith? ," No, I'm not. "," Oh, I'm so sorry. ", That ’ s all right. 
R :: Good morning. Room Reservations. May I help you? ," Yes, I ’ d like to reserve a room. "," R :: Thank you, sir. For which date and how many guests will there be in your party? ", From April 16th to 20th. Just my wife and myself. ," R :: From April 16th to 20th.And which kind of room would you prefer, sir? "," A Twin, please. "," Could you hold the line please? I ’ ll check our room availability. ( After a while ) Thank you for waiting, sir. We have a twin room at US $ 180 per night, will that be all right? "," Ok, I ’ ll take it. "," Thank you, sir. May I have your name and phone number, please? "," Sure. May name is Aaron Johnson, and my phone number is 3242-5827. "," R :: Mr. Aaron Johnson, phone number is 3242-5827. Excuse me, how do you spell your first name? "," It ’ s double A, R, O, N. "," Double A, R, O, N. Thank you, Mr. Johnson. May I know your arrival time on April 16th? ", Around 9 p. m. ," Mr. Johnson, for the unguaranteed reservation, we can only hold the room by 6 p. m., because it is the peak season now. If you make a guaranteed reservation, we can hold the room overnight. Would you like to make a guaranteed reservation by credit card? ", Fine. Do you accept American Express? , Yes. May I know the number? , It ’ s 134986 ," Thank you, Mr. Johnson. You ’ Ve made a guaranteed reservation at the Guangzhou xx Hotel, from April 16th to 20th for 5 nights. If you can ’ t arrive as schedule, please inform us before 6 p. m. on April. hank you for calling and we look forward to serving you "
"Excuse me. Miss, what does the doctor say about me? When can I be discharged? "," The doctor has examined your current situation. Since you are recovering so well, you will be discharged tomorrow. "," Great, thanks. But how can I get discharged? "," First please get the bill at the doctor's office, then pay it either with cash or by check. Even though you're discharged, you still need to take a rest at home. Don't hurry back to work until you have fully recovered. "," Yes, I will. Thanks for your care. "
What do you think? , It looks great. , I would like to purchase it. , Will this be cash or charge? ," Here, take my credit card. "," Just sign here, please. ", Sure. Here you go. , Here's your receipt. Have a nice day. 
I would like to discuss purchasing a home with you. , I can help you. What location are you looking for? , I would like to live in Pasadena or Arcadia. , Have you thought about what your needs are in terms of size? , We would like a smaller cozy cottage with 2 bedrooms and 1 bathroom. , Is living in a particular school district important to you? ," No, we don ’ t really care because they are all pretty good around here. "," Are you interested in purchasing on the lake, or would you like a home with a view? ", We really want to live in a lakeside home with a dock for our boat. ," Now that I have an idea of what you want, I can begin my search. "
This is the good life! We have it good don ’ t you think? ," Yeah of course! Although, don ’ t you ever wonder what “ could have been ”? ", What do you mean? ," Well, sometimes I think of how things could have turned out if I had done things a little differently. ", For example? ," Like for example, if I hadn ’ t studied architecture, I would have become an artist like I wanted to. "," I see. Yeah now that I think of it, I wouldn ’ t have gotten married if I hadn ’ t moved to this town and met Sally. ", You see! Everything happens for a reason! We wouldn ’ t even have met if I hadn ’ t been in that car accident ten years ago! ," Well, I have no regrets! ", I ’ ll drink to that! 
Which way is the dining car? , Two cars forward. , What time will breakfast be served? ," 7:00, sir. "
"Hello, Miss, what can I do for you this afternoon? ", I need the haircut. But you seem so busy today. ," Yes, it is, busy today. We usually have a lot more clients on the weekend. Would you like to take a sit, and wait for a while, please? "," Ok, but how long I have to wait, it is going to be more than 30 minutes. "," It should be around that, if you like, please for a free to read the magazine while you are wait. ", Thank you. ," Sorry to keep you waiting, Miss. I'll have a dresser Mr.Li is just finish with a client in a moment or two. Would you have a shampoo first? I'll get it on for you. "," Ok, thanks. "
May I help you? , I would like to find this book. , Is there a problem? , I don ’ t think you guys have it. , You should look it up on our computer. , I did that. , What came up? ," It should be on the shelf, but I didn ’ t see it. ", I can try to get the book from a different library. , I didn ’ t know you could do that. , I will call you when I find it. , I appreciate your help. 
I can't get into my room. I mean I left my room key inside. ," I see, sir. Those two ladies in front of your room did the same thing twenty minutes ago. "," Oh, did they? Well, would you give us an extra key to the room? ", I am afraid we have no extra key. So I will send somebody to your room. ," By the way, what should I do with the key when I go out? ", Please drop it at the front desk when you leave the hotel. 
"So, this is the worst story I ’ Ve heard this month. You have my real sympathy, Tim. "," You know, all I was trying to do was tell the truth but they obviously didn ’ t take it that way. "," I understand how you feel, but you ’ Ve gotta learn to move on. "," Yeah, I ’ m dealing with it. Anyway. Thank you, Mike. "
I'd like to go to Suzhou next week. Do you know how to get there by train? ," First, you should check the schedule and see which trains go to Suzhou. Make sure which train you want to take and book a ticket. ", I see. Do you know how much the ticket is? , It depends on which train do you take. , Is it far from here to Suzhou? ," Yes, it stops more than ten times on the way to Suzhou. ", How long will it take to get there? , About fifteen hours. 
"Would you like to have some icecream? I've got a variety of flavors for you to choose from. I've got strawberry, peach, chocolate, coffee, vanilla and praline. "," Wow! So many choices you have! I wish I could, but I just can't. I'm on a diet to lose weight. "," Come on, just a bite. It doesn't really hurt to have just a bite. ", I'd better not. Please don't tempt me. Please! , Gee! You are really strong-willed. , You're damn right. I'm not so easily coaxed into doing something that I think is wrong. ," Well, I'd better not tempt you. Otherwise, if I give you a piece of cake, you might ask for a glass of milk. "
Jane! What an enchanting skirt you have on! , Thank you! Guess how much it costs. ," Bright colors, smooth material, exquisite craftsmanship, soft lines... Darling, it looks elegant on you! It can't be any cheap stuff. Something around two hundred, I guess. ", Your offer is way off the mark. It set me back only sixty-five. ," Then you got a windfall! Was sixty-five the original price, or did you get a special discount? ", Neither. I drove a hard bargain with the vendor before I got the price down. , How much did she ask for? ," Three hundred! That's daylight robbery. How dare she play tricks on an old hand like me? Without hesitation, I gave my offer---no more than fifty. "," She must be fuming with anger at such a bid, wasn't she? "," Not at all! She's really been around, and seemed quite accustomed to bargaining like this. That's the trade. She only demanded a higher bid, saying the purchase price was even higher than seventy. She was lying! Then I inquired,' May I have it at sixty?' she waved her head. ", Then you pretended to go without buying it? ," Yeah. I turned around and started to move out. Just then, she yelped behind my back,' all right, all right! I may sacrifice a little. Let's fix it sixty-five! Can't be cheaper.' "
Don ’ t be worried. Please sit down and take it easy. , How could I feel easy? I ’ m really pissed. , But you should avoid finger-pointing when you haven ’ t got the real facts. , Ok. I ’ ll try my best to calm down first. 
I heard a rumor this morning... It seems Trusten Tools is going out of business.Another competitor is going bankrupt.That could be good news for us. ," I think you must have heard wrong.The truth is we are going to be taken over by Trusten.We are being bought out, and our company will be merging with our largest competitor.It' s not good news at all... ", What? We are merging with Trusten? I never thought that would happen.Will we be getting new owners? Will it affect our jobs? , Probably.The new owners will be coming to start alignment meetings nextweek.One of the big question is what to call the new conglomerate company. ," Wow, with such a big change.We won't have the same name? "," It's not only the name of our company that will change... I expect that after this acquisition, there'll be a ton of things up in the air. "
Can you book me a single room on March 31? ," Sorry, I'm afraid the hotel is full on those dates.Shall I contact another hotel for you? "," Yes, please. "
I'm looking for some blush. Do you still have some in peach rose? ," Oh, yes, that is a beautiful color. It has been very popular blush this season. I have two left. "," Great, I'll take one. "," Have you heard about our special promotion this month? If you purchase at least 18 dollar 50 cents in any Elizabeth Arden products, you will receive this black poke with a sample of lipstick, mascara and two shades of white shadow. "," Wow, that sounds like a bargain. I'm running low on facial moisturizer and toner. Could you ring those up for me too along with the blush? ", I'd be glad to. Do you need anything else? ," Oh, I almost forgot. It's my mum's birthday Saturday. I need to get her some more Chanel. Could you get me the 1.7 ounce bottle of Chanel cologne? ", That would be my pleasure. I'll wrap the perfume up in the gift box for you too. 
I can ’ t find my purse. Have you seen it? ," No, I haven ’ t. ", I ’ Ve looked everywhere for it. I must have left it somewhere. I hope I haven ’ t lost it. , Perhaps you left that at school. ," No, I had it when I left school this afternoon. ", Well. Didn ’ t you go around to the Smith after school? You might have left it there. ," Yes, I ’ d better give her a call now. ", But she can ’ t be home now. She might have gone to the library. , Perhaps I should call her later. 
"Waiter, please bring me some toast. ", Sure. What kind of toast do you like? , Pardon? ," We have white toast, whole wheat toast and rye toast. "," I see, bring me the whole wheat toast. ", Anything to drink? ," Milk, please. "
Hello.Hot water overflowed from the bathtub.Will you help me? , Would you turn off the tap? , I did it. , Then will you put all the towels under the bathroom door? , OK. I will. , I'll have our housekeeper come right away. , I'm sorry I was too tired to fall asleep. ," When you woke up, the water was coming out of the tub. ", Right.Can I compensate for the damage with the travel accident insurance? 
"Good morning, Passport, please. ", Here you are. ," Ah, thank you. Please bring your luggage here for inspection. ", Ok. But is there anything wrong? , It's just a regular inspection. Do you have anything to declare? ," I've got 6 packets of cigarettes and 2 bottles of champagne. Besides, I have two cameras, one is for my own use, and the other is a gift. "," Well, the cigarettes and the champagne are not in excess of the duty-free allowance. But according to our law, each passenger is allowed only one camera duty-free. You' ll have to pay duty for the other one. ", Ok. Where shall I pay duty for it? , Please wait a minute. I'll make out the duty memo... Here you are. Take this and pay to the woman over there. , I've paid for it. Here's the receipt. , Very well. I hope you' ll enjoy your stay in America. , Thank you. 
Did you pass the test? ," No, I didn't. ", I'm sorry to hear that. 
This is where we sing? These booths are so comfortable I think I could fall asleep! , Let's order something to eat. What are you in the mood for? , I'll have whatever you're having. ," OK. How about some spring rolls and squid balls, some pork skins, and some beer! ", Well... the beer sounds good! 
I am thinking about inviting you to a dinner. When would you have time? And what kind of food do you fancy? , That would be great. I am really in the mood for a spicy hotpot. Any special reason for the invitation? ," To thank you for helping me at work last week. If you would not have been so kind, I would not have been able to pick my parents from the airport. You really did me a big favor. Thank you so much. ", It was my pleasure. How about this evening? I feel very hungry now. ," Fine, I know a good hotpot place in the downtown area, food there is pretty spicy too. Shall we try that one? ", Ok with me. You are the boss. I will meet you downstairs after work. 
My son came home from three years in the navy. , It was a real red letter day for you. , Yeah. We rolled out the red carpet to welcome him home. 
"excuse me, could you tell me which line I ’ m supposed to stand in to buy bubble wrap and to post a package? "," you can buy the bubble wrap here, but you ’ ll have to stand in line over here to post your passage. ", that ’ s a really long line. How long do you think it ’ ll take to get through all those people? ," it takes about 3 minutes per person, so it ’ ll probably be about an hour ’ s wait. ", can I buy stamps here? , sure. How many would you like? , I need 30 for my Christmas cards. , are you sending them abroad? , twenty of them are going abroad to China and America. ," do you have any going anywhere in the EU? If you do, those are less expensive. ", no. ," ok, here you go. That will be 18 pounds and seventy two pence. ", and the bubble wrap? , that ’ s another quid. , thanks a lot. You ’ Ve been very helpful. 
What are your hobbies? , Sports. , Like what? , Basketball and swimming. 
How about eating out for a drink with me tonight. , Tonight? I'm afraid I can't. I've promised Mark to go to the gym. Can we make it tomorrow? ," No problem. Let's say 6:30 p. m. at the Royal Restaurant, OK? ", All right. See you tomorrow night. 
Hello. I am Bili and I made an appointment with you to see the house. ," Glad to meet you. This way, please. ", The house is a little too old. , But it's quite convenient for you to go to any part of the city. The subway is nearby. , Yes. That's why I like the house. 
How was your vacation in Paris? , It was exciting! 
Can I order take-out here? , We only have spring rolls today for take-out. ," Then could I have four orders, please? "," Of course, ma'am. ", Will it take long? , Not long. They'll be ready in a few minutes. 
What shall we do tonight? , How about the cinema? , That's a good idea.We haven't been there for ages. , What would you suggest to see? ," Oh, I don't know.It depends. "
Could you just hold this for me? , What are you doing? Is anything wrong? ," Yes, but I've nearly fixed it. Just take it, will you? "," Oh, yes, of course. I'm sorry-I wasn't thinking... "
Did you have a part-time job when you were still in school? ," No, I was way too busy studying all the time. How about you? "," Yeah, I worked about twenty hours a week in a pizza restaurant. ", What was that like? , It was always very busy there. , What did you do? , I stood behind the register and took pizza orders. , Did you get any perks on the job? ," Yeah, I got to eat as much pizza as I could for free. "
You are late. ," I'm sorry, it was too cold, and my car couldn't start. I had one to the garage with the heater. I tried to call you, but you couldn't get connection. ", Couldn't get connection? ," Yes, your number is out of service. ", Really? I didn't know. Let me check. You're right. , So I couldn't get through. ," It's a serious problem. I make expecting an important call. The theater is guilty. It supposed to call me this evening, and discuss my play. What were happened if they can't reach me? "," Well, the only thing you can do is pay the fee to recover your service. "
"Hello. Good morning, Stately Restaurant. May I help you? "," I would like to book a table for seven thirty o'clock, please. "," Fine, sir. For how many people, please? ", For four people. We'd like a quiet table with a fine view of the river. ," OK. What name, please? ", This is Peter Kaufman. ," Can you spell that, please? "," Peter Kaufman, P-E-T-E-R ( Peter ), K-A-U-F-M-A-N ( Kaufman ). "," Oh, thanks, Mr. Kaufman. We look forward to your visit. ", Bye-bye. 
So what kind of music turns you on? ," Rock' n'Roll, I guess. ", You mean the kind of stuff like Nirvana? , Not really. That ’ s pretty heavy metal. 
"I'm going to Bihai Park.Is this the right bus, please? "," No, you're going the wrong way. You want a 103 from Beijing Zoo. "," How can I get it, please? "," You get off at the next stop, cross the street, and you'll find the stop not far on the right hand side. ", Could I have a transfer please? , Here you are. , Thank you. 
What do you think about violence in movies? ," Personally, I'm not for it. I feel it's bad for kids to watch. "," But kids like watching things like that. It's just for fun, would't you say? "," If you ask me, I have to disagree. Something shouldn't be watched for fun. "
Why don't we get ourselves a new car? The old one's falling apart. , What a good idea! , What kind shall we get? ," We could go to more places this time, if you liked. "," Yes, fine. ", When shall we go and look? , Why not sometime next week? ," No, let's go on Saturday. ", OK. , Where shall we go? , There's a car dealer down the road. How about going there? ," No, I don't like that place. Why don't we try the garage Martin recommended? "," Fine, We'll do that. "
"Look, Jimmy's report came today. ", Let's have a look. What is this? Where are all the grades? ," He's in the third grade Sam! You see under each subject that he is being taught in school, he receives a mark from one to three. A one means his achievement or work is excellent. Here in Science for example he got a two, which means its satisfactory. ", What about here in physical education? , He got a three here which means it's unsatisfactory. We should work on that with him. , So confusing! In my day we got an A or B if we were doing well and if we failed an exam we would get an F! 
"Oh, what a beautiful garden! ", These are my roses. The roses have been in flower for a week. , The garden looks lovely when the roses are in bloom. You must have a lot of pleasure in planting flowers. ," Yes, you are right. I love flowers and hence have taken to growing them. I take care of my flowers every day as if they are my good friends. ", You did a good job. But I got tired of working in the garden. ," Oh, I see. People who don't understand the nature of flowers won't be able to grow them well. I can help you learn more if you want to plant flowers one day. In this way you need not be afraid of your own sweet flower-garden's being neglected. ", Yes. Thanks. 
"Waiter, the meat is overdone. "," I am sorry you don't like it, sir. But that's just the special point of the dish. ", Is it? ," Yes, hope you can enjoy it. "
Toronto is really a lovely place to visit. , What attracts you most? ," The Old Town, the Distillery Historic District, the Financial District and Underground City, everything is so attractive. "
May I help you? ," Yes, do you have sweaters? "," This way, please. How do you like this one? It's made of cotton. "," You have quite a range, haven't you? I would like to see some other styles. "
Have you got anything for diarrhea? ," Yes, here you are. These tablets are very effective. ", How should I take this medicine? , Take two tablets every six hours. , I see. I'll follow your instructions. , And take a good rest for a few days. , Thank you. 
Excuse me. Can I change my seat with you? I want to sit beside my friend. , Where is your seat? ," It's 9 - A in the middle part, a window seat too. "," OK, you mean the vacant one on the left? "," Yes, it is. Thank you very much. Let me help you to carry your baggage there. ", No need. I have only this small handbag with me. , Thanks. Have a nice trip. 
"Well, you seem to enjoy speaking English. ", You can't help learning when you're using it all day. You'll see. A few weeks'study in the school will have a similar effect on you. ," I hope so. You see, at the moment I find it difficult to get used to the teacher's speed and accent. I'm awfully worried, I can't reply as quickly as she seems to expect. "," Oh, she likes keeping us on our toes by getting us use English throughout the class. She doesn't mind your making mistakes, though. "," You know, speaking in class is a very good chance to put your English to practical use. "
