"It's nice and bright today, isn't it? ", Yeah. The autumn is marvelous here. , How about winter? ," That's a hard time. The air is cold and damp, and the road is often icy. "," It's boring, right? ", Sure. , Do you get much rain during the summer? , Plenty. We never worry about lack of rainwater in our area. , So you should bring an umbrella often. , That's right. 
Does he know that he has already at his wits' end? , I think he has realized that. But he is still whistling in the dark by putting up an act. , He might be driven up a wall. You should not handle your relation with him with kid gloves. ," But when I noticed that he was left in the cold, I could not help wanting to help him to get out of the situation. "
I'd appreciate it if you could help me pick out a gift for my daughter. , Would she be interested in a laptop? , That's exactly what I was thinking of. , A Mac would be an excellent gift. , I like Macs. How much for a Mac? ," You can take a 15 - inch Pro home right now for only $ 2,100. ", A Mac it is. I'll take one home with me. , She'll be very happy with this. And how do you plan to pay for it? ," I'll use my VISA, if that's okay. "," Now, if you'll just sign here, the Mac is all yours. ", Will she need anything besides what's in this box? , Everything she needs is right here in the box. , I appreciate your help. Maybe I'll be back for more computer stuff. , Your daughter should get straight A's from now on. Good-bye. 
"My dear, what's for supper? ", Red cooked carp and rape with fresh mushrooms. , What about soup? , Sour-peppery soup. , Which condiment do you use for? ," I'll use ginger, garlic scallion, hot pepper and vinegar. "," Very good, need I help you? "," No, don't need, I can do myself. ", Thanks. I can watch TV now. , But you must cook that dinner next time. ," Okay, I'll do it next time. "
Our national economy is increasing hand over fist. , That ’ s really a good phenomenon to see. , I hope it ’ ll continue for a long time. 
Ahh... What a fine day! I do feel like an outdoor exercise. , How about taking a walk in the park? , OK. It's delightful to have a walk in the park with the air so fresh. ," Oh, it's so quiet here. We have the park to ourselves, only you and me! ", Don't you see many people over there? Just on your left. ," Oh, I see them. Some are doing Taijiquan, some are performing swordplay, some are practising the Chinese Wushu. ", A growing keep-fit fever is sweeping over China. 
"Hey, Tom, what to go for a run? ", No thanks. I like to run in the morning. I ran a couple of miles when I woke up today. ," I try to do that, but I can ’ t get up early enough. "," I couldn ’ t either at first, but you get used to it. ", It ’ s so hot at lunchtime ; I ’ d rather run in the morning. ," Well, why don ’ t you come tomorrow? I ’ ll stop by your house on my way out. "," I could try, but I can ’ t say for sure if I ’ ll get up in time. What time do you want to go? ", I ’ ll give you a call around 6 o'clock and stop by around 6 thirty. ," O. K., maybe if I have someone to go with, I ’ ll be able to get up in time for a jog. "," Great, I ’ ll see you then. ", See you. 
"I'd like to buy a bottle of Centrum, a tooth brushes. ", Centrum? We have bottles of thirty and one hundred tablets. Which kind do you want? , Give me one bottle of thirty tablets. , And what kind of toothbrushes would you like? , Can I have a look at them? ," Sure. This brand is supposed to be very good, but they're expensive. Those are new products. They come in several colors and sizes. There is also hard, soft, and medium. ", Are they cheaper? ," This one is 5 % off. That one has no reduction, but you can get a free tube of toothpaste with six toothbrushes. "
Could you introduce some whitening products for me? ," Please forgive me just being frankly, madam. You don't need whitening products because you look pretty white. But you have freckles on your face. ", Then what kind of product can fade freckles? , I recommend Nisei products. This brand has a face cream which is effective on fading freckles. , How much is it? , 419 yuan. , It is too expensive for me. Do you have something cheaper? , I'm afraid there isn't. 
Where is my back pack? , I don't know. Where did you leave it? ," I just put it on the chair a while ago, but now it's gone. ", Are you sure? ," Of course, I am sure. I bet someone stole it. "," Well, you should have kept an eye on it. "
Do you have any English newspapers? ," Yes, just over there. ", I'd like to see some Mandarin textbooks too. Do you have any? ," Yes, they are just next to the newspapers actually. ", Thank you. 
When is your birthday? , August 1st. , Do you usually have a birthday party? ," Yes, we do.My parents prepare dinner for me. ", What would you do at the party? ," We sing "" Happy Birthday "" at the party and have birthday cakes. "," Do you know when people began to sing the song "" Happy Birthday ""? "," Well, I don't know. "," Let me tell you the story.In 1892, Patty Smith Hill and Mildred Hill wrote a song called "" Good Morning to you "". But later someone added the words "" Happy Birthday "" to their tune. "," So the "" Happy Birthday "" song has been popular since then? "," Yes, actually, the song has been sung since its publication in 1932.People all over the world have sung it in many different languages. "
Can I see some men's watches? , Of course. How about this one? , What functions does this watch have? , It's a luminous watch with a time-reminder function. , Is it waterproof? ," Yes, and it comes with a worldwide guarantee. ", I'll take it. Please set the watch for me. 
Did you check the internet for next week's weather forecast? , I sure did. You're in luck! It's supposed to snow all week in the mountains! , Yes! Somebody up there loves me! I knew it wasn't too late for snow. ," It is kind of strange though, to have snow in April, and so much of it. "," There have been so many dry winters lately that it's about time, don't you think? "," When you put it that way, I guess the skies can't hold out on us forever. ", This will be the best ski trip I've ever taken. I can't wait to use my new hoard. , It will be the best as long as the weatherman is right. 
Hello. I want to send the computer to my sister in Shanghai by logistics transport. , OK. Is it in the box? May I see it? , Yes. This is the computer and this is the keyboard and the monitor. , Is there anything else? , There are a mouse and a camera. , Is that all? , Yes. How much is it to send these things to Shanghai by regular delivery? ," It depends on the weight of these things. Generally speaking, we will charge you ten yuan for one kilogram. "," I see. Can you weigh them for me, please? ", Please go over there to weigh them. , OK. See you later. 
Do you mind if I come over to use your computer? ," No, but I have to type my paper tonight. ", Does that mean I can't use it tonight? , You got it! 
Happy new year! , Thank you. Same to you. , Have you got any plans? ," I've been invited over to a friend's, and you? ", My roommate's having a party. 
I remember you said that you like China because it has cheap beers. ," Yes, unbelievably cheap. Carlsborg is less than $ 1. "," Why do you drink? I mean, where does drinking get you? ", It's fashionable. ," Come on, you don't even know that blinds following is a sign of immaturity. "," Mary, it's not about the blind following. What matter is I enjoy in drinking. It's like when you get off of work. You're so tired. You need to get relaxed. You can't just turn on the TV and keep watch the programs until you fall asleep. You need to make your after work time more fun. ", How? By drinking? ," Drinking is just part of it. I mean, you have a bunch of friends coming by and having fun. You drink and talk. And the more you drink, the more you talk. It makes me so relaxed. ", When did you begin to drink? ," It's a long time ago. When I first went to a bar to pick up girls there, I saw the most beautiful girl sitting and sipping a coke. Then I went up to her and said' can I buy you a drink?' ", And then? , Then I talked to her and got her number. You know what? When you don't know what to say? Just drink. , So you get drunk every day? 
That was a great dinner. I didn't know that you knew how yo cook. , I'm glad you liked it. Are you ready for dessert? , I don't know. I'm pretty full. What are we having? , I made strawberry shortcake. ," Ooh, that's my favorite. Maybe I'll have a small slice. ", Great. Would you like coffee or tea with that? , I'll have a cup of tea. , Do you take cream or sugar with your tea? ," Actually, could I have some milk with that? ", Definitely. Would you like skim or whole milk? ," Skim, please. That'd be very nice. Thanks... oh no. Janna, I'm so sorry, but I've got to go. ", What happened? , I just got a message from my sister saying that she's been in a car accident. I need to go pick her up. , I'll go with you. Where is she? ," She's on the M40, near Reading. ", Is she alright? ," I don't know, she didn't say. I'm so sorry about this. "," Don't worry. Family comes first. Come on, let's go. "," Actually, I've only got a two-seater. I'll have to go on my own. ", Ok. Just call me if you need anything then. , I will. Thanks a lot. 
"Yes, madam, can I help you? ", I'm feeling a bit airsick. , We have the medicine for that. I'll go and get it for you. ," Thank you. oh, can you get me some orange juice as well? ", Certainly. I'll be back right away. 
how was your education going on in Australia? , I'm going to graduate this summer. ," where are you going to work then, in Australia or back in China? ", I'm planning to return to China after graduation. , why are you choosing to leave a foreign country? Many people are reluctant to leave the superior living environment abroad. ," well, I think personal development is much more important than simply having a superior living environment. "," yeah, China's developing so fast and development opportunities can be found almost in every corner of the country. "," absolutely, many Chinese enterprises are going global, and they are in great need of excellent returnees to help them with their overseas business. ", the rapidly expanding economy has encouraged many students to pack their bags AMD head for home. , that's right. Most of the Chinese students pursuing higher education in Australia intend to return to China. 
"Alice, your father is amazing. He ’ s 90 years old and he lives alone in that big house. ", I know. He doesn ’ t like to ask anyone for help. My dad insists on paying his own bills and taking care of himself! , That sounds like my Grandmother. She was always stubbornly independent. , It seems that folks like my father and your grandmother are determined to be on their own. , They see their independence as a kind of character strength. , Sometimes they are too independent. 
how did your interview go? ," pretty well. I don't know if I'll get the promotion or not, but I feel good about it. "," if you get the promotion, what will your new title be? "," if I get the promotion, I will be a senior engineer instead of an assistant engineer. "," will you get a pay-raise, too? "," whenever you are given added responsibilities, you should get a promotion. ", that makes sense. Who interviewed you? , my boss. , what kinds of questions did she ask you? , she asked me about my ability to work in a team and what I thought a good boss should be. , the second one sounds rather difficult to answer. What did you tell her? , I told her that I'm an excellent team player and that a good boss should treat male and female employees equally. , those are good answers. How did she react? ," she told me that even when I become a senior engineer, I'll have to work with the assistant engineers as a team. ", what do you think about her as a boss? , she's pretty easy to get along with. She listens to her employees and treats everyone equally. , you're lucky. Not everyone has such a great boss! , that's true. She's highly esteemed among everyone at my company. ," when you find out you get the promotion or not, let me know. ", I will do. 
You look terrific and in good shape. , Thank you. , How do you keep fit? , I do yoga twice a weeks , Yoga? It sounds interesting. ," It was hard at the beginning, but now feel it's really relaxing. It makes me flexible. ", Anything else? ," Yes, I often go swimming. ", Are you interested in swimming? ," Yes, I like it very much. "
"I'm sorry, Julia! I can't get home early this evening. ", What? But today is my birthday! ," I know, darling. But I do have a lot of work to do, hope you can understand me. "," But Steven, why don't you ask for a leave?... Steven, why don't you speak? Are you still there? "," Hello, Julia? I can't hear you clearly. I'm afraid the line is out of order. Okay, B, listen! How about I hang up now and call you back later? ", Okay! Bye! 
"Ladies and gentlemen, here is the Westminster Abbey. It's one of the oldest buildings in London. ", What a large building. Can we visit by ourselves? , Of course. Take your time and enjoy your trip. , Thank you. When and where shall we meet? , We will meet at 5:00 right here. , I see. 
"Hello, jewelry department. How may I help you? "," It's me, Ali. There's this strange guy who keeps coming around. He's been here three times this week. ", He's probably a pervert. Just ignore him. , He makes me nervous. He looks at me funny. And he never buys anything! ," Maybe he wants to get something for his girlfriend, but he's embarrassed. "
Hello! Tomorrow I'm going to need a wake-up call. , Not a problem. What time shall we call you? ," I always hit the snooze button, so give me two calls, one at 7 and another at 7 fifteen. ", It'll be our pleasure. We'll call you at 7 and then at 7 fifteen. ," Oops, cancel that. Change the second call to 7 thirty will you, please? ", No sooner said than done. Can I help you with anything else? ," No, that's about it for now. Thanks. "," Okay, sir. Have a pleasant evening. "
"Come on, fellows.Let' s enjoy my wife's cooking! "," Em, it's delicious! ", Thank you! My wife likes cooking very much. , You're lucky. 
Good afternoon. May I help you? ," Yes. I'd like to check in, please. "," May I see your ticket and passport, please? ", Sure. Here they are. , Please put your baggage on the scale. , What's the weight limit? , Thirty two kilos. , I hope my baggage aren't overweight. , No. They aren't. , May I carry this satchel? , Sure. But please attach this claim tag. , OK. , Here is your boarding pass. , Which gate? , Gate Four. Please go and have a seat in the waiting hall. , Thank you. 
"Hi, how is it going? "," Pretty good, Sam. Only the awful weather, you know. ", That ’ s right. I ’ Ve never really liked it since I got here. ," Me either, but I ’ m dealing with it anyway. "
My goodness! She is thirty seconds faster than the world record in 5000 metres race. ," Excuse me, what did you say? ", A Chinese girl has broken the world record in the Olympic Games. , That's incredible. I can't believe it. , You have to. It is sure. , How amazing! 
"That radio's pretty loud. Could you turn it down, please? ", Sorry. Was I disturbing you? ," Yes. And something else, please don't borrow my clothes without asking. ", Sorry. I guess I wasn't thinking. I won't do it again. 
I've come to say goodbye. , When do you leave? , I'm catching the eleven o'clock train. , Take care of yourself and don't forget to keep in touch. , Goodbye. Hope to see you again next year. 
Do you like that vintage clock? It's almost fifty years old. , Really? It almost looks brand new. And the color designs are so retro. ," Well, in the fifties, that clock used to be inside a drive-in burger joint. ", No way! My parents used to hang out at those places. , This is one of my favorite items. , How did you get it? 
Are you going home now? ," No, I'm not. ", What are you going to do? Are you going to work late? ," No, I'm not. I'm going to look for an apartment. ", An apartment? Why? , I'm going to try to find a place near the office. , Where are you living now? , Out in the suburbs. It's a long trip to work every day. , How are you going to find an apartment? , I'm going to buy a newspaper and check the classified ads. , Apartments in the city are expensive. ," I know, but I'm going to enroll in a night school to take a course in business management. "
"Hi, Jenny. Are you going to school now? ", Yup. I have English at 9 in the morning. , Got any plans after the class? , Not really. What about you? , We will have our midterm exams next month. I plan to look for some important books and study at the library. Do you want to join me? ," Sure. I need to return some books. They are due today. Besides, I can also read some weekly publications, magazines and newspapers. ", Great. We can go to the swimming pool in the gymnasium after that. , That sounds like a good idea. We can chill out a little in such a hot summer. Are you good at swimming? ," Well, that's a good question. I haven't swum for almost two years. I think I need more practice. "," Oh, it's almost 9. I need to hurry. I am running late now. See you after class in front of the library then. Bye! ", See you then. 
How do you like the food sold in this sidewalk snack booth? ," At least, it is better than my boxed lunch at work. I'm so fed up with the bland food. Thank you for having lunch with me! ", Any time. But I don't mind eating boxed lunch. The food sanitation is really good too. , It's hard to believe that you like it. You are so easy to be satisfied. ," Hey, it's not that bad. The food is nutritious and it's really convenient. I don't want to spend too much time on eating stuff. ", Eating is important. You are what you eat. It's not only a daily routine. ," Well, will you just go back to work after lunch? ", No. I'm going to pay the bill for the company's lunch. , But you didn't eat anything today. ," Well, the bill is paid by month. That's probably the only thing that I like about a take-out restaurant. ", All right. I'm going to the McDonald's. , For what? I thought you didn't like western food. ," No, I never did. It's for my son. He loves it, and I made an agreement with him that he can eat it once a week. "," That's really smart. My son Daniel is the same with your son. I just don't get it, why all the kids prefer western food to traditional food. "," Me, either. But, it's for sure that the children market is a really big one. ", That's for sure. It's always hard for the parents to say no to their children. 
Are you going to the annual party? I can give you a ride if you need one. , Thanks a lot. That's the favor I was going to ask you for. , The pleasure is mine. 
What is this big box at the front door? , Oh. I don't know what to do. I joined this club a long time ago and I didn't read the fine print. , What did you get yourself into? , I didn't realize that I have to buy something from them every six months. ," So, what's in the box? A fridge? ", It's a curio cabinet. The only thing is I don't even own those kinds of little keepsakes. ," I guess you'll read the fine print next time, won't you! ", Don't rub it in. Where am I going to put this huge thing? 
"John, I was talking to the travel agent about where we might be taking our vacation this year. "," I am going fishing in Alaska with my friend, Mark. ", What are you talking about? , What's wrong with heading out with Mark for vacation? ," You and I have been together for a whole year, and our vacation time should be about the two of us! ", Really? Who made that rule up? ," With that attitude, I don't really think we have much more to discuss here. ", That works for me! 
Can you recognize Mike's father in the crowd? ," Yes, he's holding a bunch of books. ", Let's run up and give him a hand. 
Last trip was very terrible. I hope everything will be fine this time. Don ’ t blow it. , Trust me. Everything will go well. 
"Well, sir. We are asking all our guests to wear a jacket and a tie in our restaurant. ", Is that so? I didn't know it. can I possibly borrow a jacket and a tie? , I am sorry ; you can't borrow a jacket and a tie. ," Then we'll return to the hotel and come back, will you change the appointment? "," Certainly, what time will you come back? "," At 7, please. ", How many in your party? , A party of 13. ," Alright, we are waiting for you at 7. "
You keep bowling spares but no strike. ," I don't know why, but I think there's something wrong with my hands. I couldn't seem to be able to control it on the first ball. "," I don't think it was the problem with your hands, you did several excellent spares. You have no problem with your hands. ", Then why couldn't I get strike on the first ball? ," The problem is you are too nervous. You want to have a strike so much, so you deliver the ball too hard. And when it comes to the I second roll, there's no pressure. That's why you could bowl all those spares. ", Really? I will try again. 
"David, why didn ’ t you clean the room? ", I ’ m not in the mood. , Why are you feeling depressed? , I was told my girlfriend was speaking ill of me. That ’ s a real let-down. , I don ’ t think she will do such a thing. , But she did and made me disappointed. ," Oh, cheer up. A girlfriend is not everything. ", But she means a lot to me. , Then forgive her mistake. 
I'm starving. Let's get something to eat. , Can we go somewhere nearby? I don't feel like walking too far. , Sure. What kind of food do you like? , I mean the food for something spicy. , How about some Korean food? There's a place right there on the corner. , That sounds great. I love Korean food. 
Could you help me with these books? , My hands are full. Can ’ t you see that? ," Please, George. "," All right. Just wait a minute, OK? "
I'm hungry. Do we have anything to eat? , Just a few cookies. , That's fine with me. 
"Excuse me, did you see a set of keys? ", What kind of keys? , Five keys and a small foot ornament. , What a shame! I didn't see them. ," Well, can you help me look for it? That's my first time here. ", Sure. It's my pleasure. I'd like to help you look for the missing keys. , It's very kind of you. ," It's not a big deal.Hey, I found them. "," Oh, thank God! I don't know how to thank you, guys. ", You're welcome. 
Can you give me more details on what is included in the package? ," Sure. The coach leaves at 6:30 a. m., in front of our office. The drive takes eight hours, with two stops to see some sights. ", What about the hotel accommodations? , You'll be staying at Holiday Inn. It's a three-star hotel with two restaurants and a swimming pool. , Great. What types of things will we do at Lushun Falls? , The second day you take a four-hour city tour. In the afternoon you go on the famous boat cruise under the falls. 
Could you give me a taxi to pick me up and take me to the airport before 1:00 p. m.? ," What is your address, sir? ", I live in room 1106 of the Friendship Hotel. ," OK, someone will be there by 12:15. "
"You are blue in the face, arn't you? "," The cat has eaten my fish, I'll kill it. "," But supposing your son killed like the fish, what do you think then? ", I'll beat him. ," So beat the cat, but don't kill it. "
"Hello. I have a room booked for tonight, the 15th. "," Alright and what is your name, please? ", It's Marcia Gleason. ," Ah, yes, here you are Ms. Gleason. You reserved a single, right? "," Yes, a single, thanks. ", Do you mind being next to the elevator? ," Actually, I'd prefer not to be. "
"It's crunch time, isn't it? I wasn't nervous before the meeting, but now I am. ", No kidding. Time is running out. , It would help to bring in a couple more troubleshooters. , Vince says he can't afford anybody else. We're got to come through. , Do you think we'll make it? ," I guess we'll either make it, or we won't. "
Can I help you? , Yes.When is the next train to New York City? ," Let me see... the train to New York City... here it is... daily except Sunday at ten thirty, twelve twenty and fifteen ten. ", Aren't there any trains before ten thirty? ," Sorry, not before ten thirty. ", Then one to New York at ten thirty. , One way or round trip? , One way. , A soft seat or hard one? , How much is a soft? ," 15 dollars.And for a hard one, only 6 dollars. "," Then one hard seat, please. ", OK.Here is your change.The train leaves on platform 8. 
No. 164 in lane 3 achieved 11' 16 in the 100 meter dash. Isn't that something? , Yeah. He's the most experienced athlete in the field. , He won the first place! , Good boy! 
I have an appointment for half past one. , What can I help you with? ," Well, I have a problem with my class schedule. ", What is it? , It seems that I've been given two classes scheduled at the same time. , I can understand the problem with that. , Is there any way that you can fix my schedule? ," No problem, do you want those classes still? "," Yes, I do. ", Let me see if I can find one of these classes on another day. , Thank you very much. 
What would be a good day to finally move into the house? , You can pick up your keys on Tuesday night. When you actually move in is up to you. ," Will the electricity and water be on, or do we need to do something to get it turned on? ", Make sure that you transfer the utilities to your name and tell them when you will be moving in. ," The carpet needs to be cleaned, and I want to paint the walls a different color. ", An empty house is easier to paint and clean. Take a few days to take care of those things before you start moving your furniture in. , I want my appliances to be delivered as we are moving into the house. , I think that will work out just fine. It will help when you move your groceries in and need to keep them cold. , Would you be willing to help me do a few things on the day I move in? , My grandmother needs me to help her trim her roses that day. 
